{
  "$schema": "../schema/generated-costs.schema.json",
  "formatVersion": 1,
  "generatedBy": "HomeScout.CostEngine.Generator",
  "snapshotDate": "2026-10-23",
  "money": "integer pence",
  "rounding": "Each yearly amount is divided by 12 and rounded once to the nearest penny, halves away from zero; a total is the sum of its rounded lines; a mortgage repayment is rounded once from the exact fraction (decision 0021).",
  "homes": [
    {
      "homeId": "B1",
      "mode": "buy",
      "nation": "England",
      "coverage": "covered",
      "storyId": "BUYER",
      "scenarios": [
        {
          "scenarioId": "from-step-1",
          "fromStep": 1,
          "toStep": 3,
          "mortgage": {
            "id": "B1.from-step-1.mortgage",
            "loan": {
              "id": "B1.from-step-1.mortgage.loan",
              "pence": 16000000
            },
            "rateBasisPoints": 550,
            "termYears": 25,
            "payments": 300,
            "monthlyRepayment": {
              "id": "B1.from-step-1.mortgage.monthly-repayment",
              "pence": 98254
            },
            "evidenceIds": [
              "B1-PRICE",
              "HH-MORTGAGE-DEPOSIT",
              "HH-MORTGAGE-RATE",
              "HH-MORTGAGE-TERM"
            ]
          },
          "monthly": {
            "lines": [
              {
                "id": "B1.from-step-1.monthly.mortgage-repayment",
                "category": "mortgage-repayment",
                "status": "calculated",
                "pence": 98254,
                "sourcePeriod": "month",
                "evidenceIds": [
                  "B1-PRICE",
                  "HH-MORTGAGE-DEPOSIT",
                  "HH-MORTGAGE-RATE",
                  "HH-MORTGAGE-TERM"
                ]
              },
              {
                "id": "B1.from-step-1.monthly.service-charge",
                "category": "service-charge",
                "status": "calculated",
                "pence": 20000,
                "sourcePeriod": "year",
                "evidenceIds": [
                  "B1-SC-LISTING"
                ]
              },
              {
                "id": "B1.from-step-1.monthly.ground-rent",
                "category": "ground-rent",
                "status": "calculated",
                "pence": 2083,
                "sourcePeriod": "year",
                "evidenceIds": [
                  "B1-GROUND-RENT"
                ]
              },
              {
                "id": "B1.from-step-1.monthly.council-tax",
                "category": "council-tax",
                "status": "calculated",
                "pence": 17500,
                "sourcePeriod": "year",
                "evidenceIds": [
                  "B1-CT-CHARGE"
                ]
              },
              {
                "id": "B1.from-step-1.monthly.energy",
                "category": "energy",
                "status": "calculated",
                "pence": 8500,
                "sourcePeriod": "month",
                "evidenceIds": [
                  "B1-ENERGY-ESTIMATE"
                ]
              },
              {
                "id": "B1.from-step-1.monthly.water",
                "category": "water",
                "status": "calculated",
                "pence": 4500,
                "sourcePeriod": "month",
                "evidenceIds": [
                  "B1-WATER-ESTIMATE"
                ]
              },
              {
                "id": "B1.from-step-1.monthly.broadband",
                "category": "broadband",
                "status": "calculated",
                "pence": 3000,
                "sourcePeriod": "month",
                "evidenceIds": [
                  "B1-BROADBAND-ESTIMATE"
                ]
              },
              {
                "id": "B1.from-step-1.monthly.buildings-insurance",
                "category": "buildings-insurance",
                "status": "included",
                "evidenceIds": [
                  "B1-INSURANCE"
                ]
              },
              {
                "id": "B1.from-step-1.monthly.maintenance",
                "category": "maintenance",
                "status": "not-calculated",
                "evidenceIds": [
                  "B1-MAINTENANCE"
                ]
              }
            ],
            "total": {
              "id": "B1.from-step-1.monthly.total",
              "pence": 153837,
              "isPartial": true,
              "partialReasons": [
                {
                  "lineId": "B1.from-step-1.monthly.maintenance",
                  "category": "maintenance",
                  "status": "not-calculated"
                }
              ]
            },
            "budget": {
              "id": "B1.from-step-1.monthly.budget",
              "budgetPence": 160000,
              "budgetSource": "household:RIVERS.monthlyBudget",
              "differencePence": 6163,
              "withinBudget": true,
              "basedOnPartialTotal": true
            }
          },
          "upfront": {
            "lines": [
              {
                "id": "B1.from-step-1.upfront.mortgage-deposit",
                "category": "mortgage-deposit",
                "status": "calculated",
                "pence": 3000000,
                "sourcePeriod": "once",
                "evidenceIds": [
                  "HH-MORTGAGE-DEPOSIT"
                ]
              },
              {
                "id": "B1.from-step-1.upfront.moving-costs",
                "category": "moving-costs",
                "status": "calculated",
                "pence": 120000,
                "sourcePeriod": "once",
                "evidenceIds": [
                  "HH-MOVING-COSTS"
                ]
              },
              {
                "id": "B1.from-step-1.upfront.stamp-duty",
                "category": "stamp-duty",
                "status": "not-calculated",
                "evidenceIds": [
                  "B1-STAMP-DUTY"
                ]
              },
              {
                "id": "B1.from-step-1.upfront.legal-fees",
                "category": "legal-fees",
                "status": "not-calculated",
                "evidenceIds": [
                  "B1-LEGAL-FEES"
                ]
              }
            ],
            "total": {
              "id": "B1.from-step-1.upfront.total",
              "pence": 3120000,
              "isPartial": true,
              "partialReasons": [
                {
                  "lineId": "B1.from-step-1.upfront.stamp-duty",
                  "category": "stamp-duty",
                  "status": "not-calculated"
                },
                {
                  "lineId": "B1.from-step-1.upfront.legal-fees",
                  "category": "legal-fees",
                  "status": "not-calculated"
                }
              ]
            }
          },
          "changesFromPrevious": []
        },
        {
          "scenarioId": "from-step-4",
          "fromStep": 4,
          "toStep": 4,
          "mortgage": {
            "id": "B1.from-step-4.mortgage",
            "loan": {
              "id": "B1.from-step-4.mortgage.loan",
              "pence": 16000000
            },
            "rateBasisPoints": 550,
            "termYears": 25,
            "payments": 300,
            "monthlyRepayment": {
              "id": "B1.from-step-4.mortgage.monthly-repayment",
              "pence": 98254
            },
            "evidenceIds": [
              "B1-PRICE",
              "HH-MORTGAGE-DEPOSIT",
              "HH-MORTGAGE-RATE",
              "HH-MORTGAGE-TERM"
            ]
          },
          "monthly": {
            "lines": [
              {
                "id": "B1.from-step-4.monthly.mortgage-repayment",
                "category": "mortgage-repayment",
                "status": "calculated",
                "pence": 98254,
                "sourcePeriod": "month",
                "evidenceIds": [
                  "B1-PRICE",
                  "HH-MORTGAGE-DEPOSIT",
                  "HH-MORTGAGE-RATE",
                  "HH-MORTGAGE-TERM"
                ]
              },
              {
                "id": "B1.from-step-4.monthly.service-charge",
                "category": "service-charge",
                "status": "calculated",
                "pence": 31000,
                "sourcePeriod": "year",
                "evidenceIds": [
                  "B1-SC-BUDGET"
                ]
              },
              {
                "id": "B1.from-step-4.monthly.ground-rent",
                "category": "ground-rent",
                "status": "calculated",
                "pence": 2083,
                "sourcePeriod": "year",
                "evidenceIds": [
                  "B1-GROUND-RENT"
                ]
              },
              {
                "id": "B1.from-step-4.monthly.council-tax",
                "category": "council-tax",
                "status": "calculated",
                "pence": 17500,
                "sourcePeriod": "year",
                "evidenceIds": [
                  "B1-CT-CHARGE"
                ]
              },
              {
                "id": "B1.from-step-4.monthly.energy",
                "category": "energy",
                "status": "calculated",
                "pence": 8500,
                "sourcePeriod": "month",
                "evidenceIds": [
                  "B1-ENERGY-ESTIMATE"
                ]
              },
              {
                "id": "B1.from-step-4.monthly.water",
                "category": "water",
                "status": "calculated",
                "pence": 4500,
                "sourcePeriod": "month",
                "evidenceIds": [
                  "B1-WATER-ESTIMATE"
                ]
              },
              {
                "id": "B1.from-step-4.monthly.broadband",
                "category": "broadband",